<?xml version='1.0' encoding='ISO-8859-1'?>
<QContainers xmlns:xsi="http://www.w3.org/2001/XMLSchema-instance" xsi:noNamespaceSchemaLocation="../../../WEB-INF/classes/de/d3web/dialog2/dialoglayout.xsd">
	<!--
		<Default gridgap="0" padding="1px" qContainerBorder="1px solid black"
		questionBorder="1px solid black"> </Default>
	-->
	<!--
		<Default gridgap="3" padding="3px" qContainerBorder=""
		questionBorder="1px dotted red"> <QuestionHeadline showHeadline="true"
		showButton="true" color="#222" headlineMargin="0px 0px 15px 10px" />
		<QuestionAnswers answerChoiceType="checkbox" columns="1" color="#444"
		font="" inputWidth="" inputHeight="" /> </Default>
	-->
	<!-- Allgemeines -->
	<QContainer id="Q56">
		<Dimension rows="2" cols="1" />
		<Default gridgap="1" padding="" qContainerBorder=""
			questionBorder="3px outset #00f">
			<QuestionHeadline showHeadline="true" showButton="true"
				color="#fff" />
			<QuestionAnswers answerChoiceType="checkbox" columns="0"
				color="#f00" />
		</Default>
		<Question id="Mf58" padding="" border=""> <!-- Baujahr -->
			<Position posX="0" posY="0" />
			<QuestionHeadline showHeadline="true" showButton="true"
				color="" />
			<QuestionAnswers columns="0" />
		</Question>
		<Question id="Mf57"> <!-- Automarke -->
			<Position posX="0" posY="1" />
			<QuestionHeadline showHeadline="false" showButton="true"
				color="#0ff" />
			<QuestionAnswers answerChoiceType="checkbox" columns="5"
				color="#00f" font="" inputWidth="" inputHeight="" />
		</Question>
	</QContainer>
    
    <!-- Detailangaben -->
	<QContainer id="Q66">
		<Dimension rows="1" cols="1" />
		<Default gridgap="1" padding="15px 10px">
			<QuestionHeadline showHeadline="true" showButton="true"
				color="" />
			<QuestionAnswers answerChoiceType="checkbox" columns="0"
				color="" font="" inputWidth="" inputHeight="" />
		</Default>
		<Question id="Mf54" padding="5px" border="3px dotted green">
			<!--
				Autotyp
			-->
			<Position posX="0" posY="0" />
			<QuestionHeadline showHeadline="false" showButton="true"
				color="" />
			<QuestionAnswers answerChoiceType="list" columns="4"
				color="" font="" inputWidth="180px" inputHeight="130px" />
		</Question>
	</QContainer>
    
    
    
    <!-- Beobachtungen -->
	<QContainer id="Q16">
		<Dimension rows="5" cols="3" />
		<!--
			<Default gridgap="10" padding="15px" questionBorder="1px solid #0f0">
			<QuestionHeadline showHeadline="true" showButton="true" />
			<QuestionAnswers answerChoiceType="checkbox" /> </Default>
		-->
		<Question id="Mf2"><!-- Abgase -->
			<Position posX="0" posY="0" />
		</Question>
		<Question id="Mf8"><!-- Verhalten Motorstart -->
			<Position posX="1-2" posY="0" />
		</Question>
		<!--
			<HtmlText> <Position posX="0-2" posY="1"/> <HtmlTextContent>
			<![CDATA[ <h2>huhu, ich bin eine Box hier drinne!</h2> <p>Ein Bild
			aus dem MM Ordner mit width 100px: <Image
			width="100px">dorfongolf.jpg</Image></p> ]]> </HtmlTextContent>
			</HtmlText>
		-->
		<Question id="Mf3"><!-- Auspuffrohrfarbe -->
			<Position posX="0-2" posY="1" />
			<QuestionImage file="auspuff_pic_temp.jpg" align="center"
				answersPosition="right">
				<AnswerRegion answerID="Mf3a1" xStart="0" xEnd="219"
					yStart="0" yEnd="138" />
				<AnswerRegion answerID="Mf3a3" xStart="221" xEnd="479"
					yStart="0" yEnd="138" />
				<AnswerRegion answerID="Mf3a2" xStart="0" xEnd="219"
					yStart="140" yEnd="307" />
				<AnswerRegion answerID="Mf3a4" xStart="221" xEnd="479"
					yStart="140" yEnd="307" />
			</QuestionImage>
		</Question>
		<Question id="Mf4"><!-- Bezinart -->
			<Position posX="0" posY="2-3" />
		</Question>
		<Question id="Mf5"> <!-- Ueblicher Verbrauch -->
			<Position posX="1-2" posY="2" />
		</Question>
		<Question id="Mf6"><!-- Tatsaechl. Verbrauch -->
			<Position posX="1-2" posY="3" />
		</Question>
		<Question id="Mf7"><!-- Motorgeraeusche -->
			<Position posX="0" posY="4" />
		</Question>
		<Question id="Mf9"><!-- Fahrverhalten -->
			<Position posX="1-2" posY="4" />
		</Question>
		<!--
			<HtmlText> <Position posX="2" posY="4-5" /> <HtmlTextContent>
			<![CDATA[<h3 style="color: red">oh, hier is ja noch eine!</h3>]]>
			</HtmlTextContent> </HtmlText>
		-->
	</QContainer>
</QContainers>